File Name,Name,Organization,Location,Skill Score,Collaboration Score,Adaptability Score,Overall Score,Category
98559931.pdf.txt,People Tools,Administrative Accounting Payroll Human Resources,ADP,4,2,2,8,ACCOUNTANT
53640713.pdf.txt,Cheif Accountant,Long TermPermanentContract Opportunity Financial Statement Management Reporting Cost Accounting Asset Management Budgeting,Qatar,4,2,2,8,ACCOUNTANT
15906625.pdf.txt,Accountant Aug,Accounting Bookkeeping Services Financial,the City of Alexandria,4,2,0,6,ACCOUNTANT
17306905.pdf.txt,Respond,Daily Accounting,US,4,2,0,6,ACCOUNTANT
14126433.pdf.txt,Core Qualifications,Microsoft Office,SAP,4,2,0,6,ACCOUNTANT
